Date,Text
2026/7/24,"Bitcoin holds near $65,000 as crypto markets largely unaffected by $800 billion AI sell-off."
2026/7/23,"MicroStrategy, BlackRock, Fidelity Digital Assets, and seven other industry giants have formed the Bitcoin Security Alliance, aiming to guard against future quantum threats."
2026/7/22,First confirmed failure case of a DAT: Shareholders of UK Bitcoin treasury company Satsuma liquidate 668 BTC.
2026/7/21,"An ancient Bitcoin whale from 2013 clears out its position: transferring 1,000 BTC to Binance! Worth approximately $65.56 million."
2026/7/20,U.S. spot Bitcoin ETFs see second week of net inflows! Citi slashes forecast: 12?month inflows cut from $1 billion to zero.
